{
  "schema": 1,
  "kind": "kevin-composite-skill",
  "id": "skill-lab-recovery-isolation-create-text",
  "version": "1",
  "authority": "GREEN",
  "name": "Skill Lab Recovery Isolation - Create Text",
  "description": "Minimal post-repair isolation proof using only the already-proven GREEN create_text primitive.",
  "steps": [
    {
      "operation": "create_text",
      "payload": {
        "filename": "Kevin Skill Lab Recovery Isolation Proof.md",
        "content": "# Kevin Skill Lab Recovery Isolation Proof\n\nThis artifact proves that the repaired Composite Skill Lab can dispatch and verify one already-PROVEN GREEN create_text primitive. It grants no new primitive authority.\n"
      }
    }
  ]
}
