{
  "schema": 1,
  "kind": "kevin-composite-skill",
  "id": "west-motor-aging-inventory-action-pack",
  "version": "1",
  "authority": "GREEN",
  "name": "West Motor Aging Inventory Action Pack",
  "description": "Creates a five-sheet aging inventory action board plus SOP so West Motor can chase aged units with honest next actions without inventing prices, purchases, live DMS writes, or public posting.",
  "steps": [
    {
      "operation": "create_spreadsheet",
      "payload": {
        "filename": "Kevin West Motor Aging Inventory Action Board.xlsx",
        "workbook": {
          "schema": 1,
          "kind": "kevin-xlsx-spec",
          "sheets": [
            {
              "name": "Aging Board",
              "rows": [
                ["Stock", "Year Make Model", "Days In Stock", "Age Band", "Stage", "Owner", "List Status", "Next Action", "Due", "Notes"],
                ["", "", "", "0-30 / 31-60 / 61-90 / 90+", "HOLD / RETAIL PUSH / WHOLESALE REVIEW / SPECIAL", "", "LISTED / UNLISTED / UNK", "", "", "Do not invent prices"]
              ]
            },
            {
              "name": "Action Ladder",
              "rows": [
                ["Stock", "Current Ladder Step", "Photo Ready", "Price Review Due", "Wholesale Option", "Retail Push Idea", "Trade Special?", "Who Decides", "Status", "Notes"],
                ["", "PHOTO / PRICE / CHANNEL / DISPOSITION", "NO", "", "REVIEW ONLY", "", "NO", "MATT", "OPEN", "No auto purchase or post"]
              ]
            },
            {
              "name": "Price Notes",
              "rows": [
                ["Stock", "Current Ask", "Ask Source", "Market Notes", "Recon Left Band", "Honest Margin Guess", "Verified?", "Blocks Sale?", "Updated At", "Notes"],
                ["", "", "DMS / SHEET / UNK", "", "", "", "NO", "MAYBE", "", "Never invent ACV wholesale or retail"]
              ]
            },
            {
              "name": "Blockers Chase",
              "rows": [
                ["Stock", "Blocker", "Blocks Sale?", "Who Owns", "Asked At", "ETA", "Status", "Needs Purchase?", "Needs Live Post?", "Notes"],
                ["", "", "YES", "", "", "", "OPEN", "NO", "NO", "No auto purchase no DMS write no live post"]
              ]
            },
            {
              "name": "Weekly Focus",
              "rows": [
                ["Week Of", "Top Aged Unit", "Why This Week", "One Move", "Owner", "Done?", "Carry Forward?", "Risk If Idle", "Review With", "Notes"],
                ["", "", "", "", "", "NO", "MAYBE", "", "MATT", "Pick the smallest honest move"]
              ]
            }
          ]
        }
      }
    },
    {
      "operation": "create_text",
      "payload": {
        "filename": "Kevin West Motor Aging Inventory Action - SOP.md",
        "content": "# Kevin West Motor Aging Inventory Action\n\nUse this pack to chase aged inventory with honest next actions. Do not invent prices or market values.\n\n## Operating rule\nAging action is false until the unit is on Aging Board with an age band, owner, and a real next action. Prefer the smallest ladder step that clears the next blocker. Never invent ACV, wholesale, or retail figures.\n\n## Required sequence\n1. Log aged units on Aging Board with days, age band, stage, and known facts only.\n2. Place each unit on Action Ladder (photo, price review, channel, disposition) without auto-posting.\n3. Fill Price Notes only from asks already in hand; mark UNK and Verified=NO when unknown.\n4. Chase Blockers without purchases, live DMS writes, or live public posts.\n5. Pick one Weekly Focus unit and one honest move; review with Matt before paid or live side effects.\n\n## Protective behavior\nKevin must not invent prices, purchase reports, write live DMS, post listings, widen Chat tools beyond Desktop exact-5, or claim READY while blockers remain. Sheet count stays at or below five. Payloads stay ASCII-safe. Sheet names use spaces only (no slash).\n"
      }
    }
  ]
}
